,Funding,counts
8330,University of Wisconsin Translational Research Initiatives,1
5650,"National University Singapore Yong Loo Lin School of Medicine, Singapore",1
5663,Nationwide Children's Hospital,1
8334,"University of the East, UE",1
8417,"Vanier Canada Graduate Scholarship, Canada",1
5822,"Nipro Home Diagnostics, Inc.",1
5825,Nitto Boseki Co. Ltd.,1
5662,Nationales Aktionsforum Diabetes Mellitus,1
5658,National and Local Joint Engineering Research Centre for Mongolian Medicine Research and Development,1
5824,Nitten Pharmaceutical,1
8333,University of York,1
5664,Nationwide Children’s Hospital,1
5661,National “Twelfth Five-Year” Plan for Science and Technology Support,1
5651,National University industry university,1
8414,"Vanderbilt University Medical Center, VUMC",1
5660,National key research plan,1
8323,University of Vermont Medical Center,1
5652,"National University of Sciences and Technology, NUST",1
5659,National eye Institute Center Core,1
8422,Vejle County,1
5649,National Twelfth Five-Year Plan for Science and Technology Support,1
8335,University-level Scientific Research Projects of Hunan University of Chinese Medicine,1
8320,University of Utah Neuroscience Initiative,1
8337,"UniversitÃ¤tsspital ZÃ¼rich, USZ",1
5812,"Nippon Boehringer Ingelheim Co., Ltd.",1
5831,Non-Profit Corporation,1
8338,"UniversitÃ© Laval, UL",1
5830,Non-Profit Central Research Institute Fund of Chinese Academy of Medical Sciences,1
5667,Natural Foundation of the Education Department of Sichuan Province,1
5829,Non-NET-University Grants Commission,1
8331,"University of Wisconsin, Madison, School of Medicine",1
5656,National and International Networking program,1
5828,Nobuhisa Mizuno and Hirofumi Fukumoto,1
5655,National and Central Health and Medical Research Councils of Australia,1
8421,"Vedecká Grantová Agentúra MŠVVaŠ SR a SAV, VEGA",1
8418,Vasa Hospital District,1
5666,Natural Foundation of Chengdu Medical College,1
8325,University of Washington,1
8413,Vanderbilt Mouse Metabolic Phenotype Center,1
8336,"UniversitÃ¤t Ulm, UULM",1
8321,University of Utah Research Foundation,1
5813,"Nippon Boehringer Ingelheim Co., Ltd. or Eli Lilly Japan K.K",1
5826,Nitto Foundation,1
8351,"Universität Regensburg, UR",1
5804,Ningbo Science & Technology Program,1
5718,Natural Sciences and Engineering Research Council of Canada,1
5755,New England Eye Center,1
5841,Norte Portugal Regional Programme,1
5717,Natural Sciences Foundation of Hunan province,1
8377,Ursula Mandel Fellowship,1
5757,New England Ophthalmological Society 2020,1
5715,Natural Science Project of Education Department of Sichuan Province,1
8361,"Universitätsmedizin der Johannes Gutenberg-Universität Mainz, Augenklinik und Poliklinik, Mainz",1
5759,New Jersey Lions Eye Research Foundation,1
5714,Natural Science Key Project of Jiangxi Province,1
5713,Natural Science Key Project of Anhui University of Chinese Medicine,1
5712,Natural Science Fund for Distinguished Young Scholars of Jiangxi Province of China,1
5760,New Jersey Medical School,1
5761,New South Wales,1
5762,New Technology Funds of Xijing Hospital,1
5710,"Natural Science Foundation of Zhejiang ince,China",1
8360,Universitätsmedizin Göttingen Georg-August-Universität,1
8378,Urumqi Science and Technology Bureau,1
8380,"Utah Department of Health, UDOH",1
8381,Utah Lions Eye Bank,1
8359,"Universitätsklinikum des Saarlandes, Klinik für Augenheilkunde",1
5763,New World Medical,1
8382,V A,1
5764,New York City Public Health Laboratory,1
8383,V eterans Affairs,1
5765,New York Eye and Ear Chairman,1
8385,VA CART,1
5766,New York Eye and Ear Infirmary Chairman,1
8358,Universitätsklinikum Würzburg,1
8386,VA Cooperative,1
8363,"Universitätsspital Zürich, USZ",1
8376,"Urban Child Institute, UCI",1
5768,"New York Eye and Ear Infirmary Research Foundation , New York, New York",1
5720,Natural Sciences at Linnaeus University,1
5735,NeoVista,1
8372,UpToDate,1
5736,Nestlé Home Care,1
8371,Unrestricted Department Funding from Research to Prevent Blindness,1
5737,Nestlé HomeCare,1
5738,Netherlands Association for Health Research and Development,1
5739,Netherlands Foundation for Cardiovascular Excellence,1
5740,Netherlands Heart Foundation,1
5732,Nektar Therapeutics,1
8370,Uniwersytet Medyczny im. Piastów Slaskich we Wroclawiu,1
5731,Nederlandse Vereniging tot Verbetering van het Lot der Blinden,1
8374,Uppsala Universitet,1
8375,Uppsala‐Örebro Regional Research Council,1
8369,Université de Strasbourg,1
5728,Nederlandse Oogonderzoek Stichting,1
5744,"Networking Biomedical Research Centre in the subject area of Bioengineering, Biomaterials and Nanomedicine",1
5727,Nebraska Health System,1
5726,Nebraska Center for the Prevention of Obesity Diseases,1
5745,NeuroMac DFG/Transregional,1
5725,Navigen Inc.,1
8367,"Université de Liège, ULg",1
5748,Neurophysiology Research Center,1
8366,"Université de Lausanne, UNIL",1
5724,Navartis International AG,1
5723,Navamindradhiraj University,1
5751,Neurotech FPO,1
5722,Naval Health Research Center,1
5721,Nature Science Foundation of Jiang Xi Province,1
5753,Neurovascular Research Laboratory,1
5702,"Natural Science Foundation of Shenzhen, China",1
8387,VA Informatics and Computing Infrastructure,1
5803,Ningbo Municipal Science and Technology Innovative Research Team,1
5687,Natural Science Foundation of Hunan Province,1
5686,Natural Science Foundation of Hunan,1
5788,"Nidek Medical Products, Inc.",1
5685,Natural Science Foundation of Hubei Province,1
8400,Valbiotis,1
8373,Uppsala Foundation for Medical Research,1
5789,"Nidek, Inc.",1
8350,"Universität Innsbruck, uibk",1
5791,Nigeria Blindness,1
5792,NightstaRx,1
5793,NightstaRx Ltd.,1
5794,Nightstar Therapeutics,1
5795,"Nihon Medi-Physics, NMP",1
5796,Nihon-Boehringer Ingelheim,1
8349,Universität Heidelberg,1
8348,Universität Greifswald,1
5684,Natural Science Foundation of Henan Province,1
8402,Valeant Pharmaceuticals International,1
5797,Nijmeegse Oogonderzoek Stichting,1
5682,Natural Science Foundation of Hebei Province,1
5798,"Nikkiso Co., Ltd.",1
8403,Valeant Pharmaceuticals/Mass,1
5799,Nils Erik Holmstens,1
5681,Natural Science Foundation of Guangzhou City,1
5680,Natural Science Foundation of Guangxi Province,1
5800,Nimbus Pharmaceuticals,1
8404,Valeant Pharmaceuticals/Massachusetts Eye and Ear,1
8405,Valeant and Zealand,1
8406,Valentin Haüy Association,1
8346,"Università di Pisa, UniPi",1
5787,Nidek Medical Products Inc,1
5688,"Natural Science Foundation of Hunan University of Chinese Medicine, China",1
5769,"New York Eye and Ear Infirmary Research Foundation, New York, New York",1
5689,Natural Science Foundation of Hunan province,1
5771,New York Regional Center for Diabetes Translation Research,1
5772,"New York State Library, NYSL",1
5773,"New York State Office of Mental Health, OMH",1
5774,"New York State Office of Science, Technol- ogy, and Academic Research",1
8389,"VA Merit Award, Research to Prevent Blindness",1
8391,VGH,1
8392,VHA,1
8357,Universitätsklinikum Magdeburg AöR,1
8394,VIVA Foundation for Children with Cancer,1
5696,Natural Science Foundation of Nantong University,1
8395,VSC,1
8396,Vaarn om Synet,1
5694,Natural Science Foundation of Jilin Province,1
8356,"Universitätsklinikum Freiburg, Klinik für Augenheilkunde",1
5777,New Zealand Bone and Mineral Society,1
5778,New Zealand College of Ophthalmologists,1
5779,New Zealand Lottery Health Research,1
5780,New Zealand Marsden Fund,1
5693,Natural Science Foundation of Jiangxi Provincial Department of Science and Technology,1
5781,New Zealand National Eye Centre,1
8355,"Universitätsklinikum Carl Gustav Carus, Klinik und Poliklinik für Augenheilkunde",1
8397,Vaasa Hospital District,1
5783,Newcastle University,1
8354,Universitäts-Augenklinik,1
5785,Newfoundland and Labrador Innovation and Rural Development Infrastructure Fund,1
8399,Vajira Hospital,1
5786,Nicolaus and Margrit Langbehn Foundation,1
5690,Natural Science Foundation of Jiangsu Colleges and Universities,1
8353,Universität Wien,1
5840,"Norges Teknisk-Naturvitenskapelige Universitet, NTNU",1
8269,University of Oklahoma Growth Fund,1
5842,"North American Menopause Society, Society for Women's Health Research Pharmaceutical Company",1
5988,Oculis and Heidelberg Engineering,1
6041,Oklahoma City,1
8159,University of Alberta Faculty of Medicine and Dentistry,1
8160,"University of Alberta, U of A",1
8161,"University of Alberta, UofA",1
6038,Oklahoma Center for the Advance- ment of Science and Technology,1
8162,University of Allahabad India,1
8163,"University of Arizona, UA",1
6036,Oklahoma,1
6035,Okinawa Science & Technology Innovation System,1
8164,"University of Arkansas for Medical Sciences, UAMS",1
6034,Okayama University Hospital,1
6033,Okayama Medical Foundation,1
6032,Oishi Kenko Inc.,1
6031,Ohr Pharmaceuticals,1
6030,Ohio University's Diabetes Research Initiative,1
8166,University of Auckland Staff Research Fund,1
8167,University of Beira Interior— Health Sciences Research Centre,1
8168,University of Bristol,1
6027,Ohio Dept Development,1
6042,Oklahoma City Area Indian Health Service,1
6043,"Oklahoma Department of Transportation, ODOT",1
6044,Oklahoma Nathan Shock Center of Excellence in the Biology of Aging,1
6055,Omron Healthcare,1
8151,University Natural Science Research Project of Anhui Province,1
8152,University Paris 7,1
8153,University Synergy Innovation Program of Anhui Province,1
6060,Ono Pharma Co. Ltd.,1
6059,Ono Pharma Co.,1
6058,Ono Pharma,1
8154,University Ulm,1
8155,University and Research,1
8156,"University of Aberdeen, ABDN",1
6045,Oklahoma Shared Clinical and Translational Resources,1
6054,OmniPod® Insulin Management System,1
6053,Omeicos Therapeutics,1
6052,Ollqvist Foundation,1
6051,Ollie och Elof Ericssons Stiftelse,1
6050,Olle Engkvist Foundation,1
6049,Oliver Brickhead and Micheal Pantich Research Funds,1
6047,Olga Jonsson,1
6046,Oklahoma Tobacco Settlement Endowment Trust,1
6025,"Ohio Department of Development, ODOD",1
8170,"University of Calgary, U of C",1
6024,Ohio Department of Development,1
5993,"Office of Academic Links, Chinese University of Hong Kong",1
6002,Office of Research,1
6001,Office of Proposal Services,1
5999,Office of Minority Health,1
8194,"University of Colorado, Departments of Epidemiology and Pediatrics",1
5998,Office of Medical Student Research at Vanderbilt University School of Medicine,1
5997,"Office of Family Assistance, OFA",1
5996,Office of Faculty Affairs,1
5994,"Office of Disease Prevention and Health Promotion, ODPHP",1
8195,"University of Crete, UoC",1
8192,"University of Colorado School of Medicine, Anschutz Medical Campus",1
8196,"University of Cumbria, UoC",1
8197,"University of Dammam, UOD",1
8199,University of Dundee School of Medicine,1
8200,University of Edinburgh,1
5991,Oejenfonden,1
8202,"University of Electronic Science and Technology of China, UESTC",1
8203,University of Evry Val d’Essonne,1
8204,"University of Florida Diabetes Research, Education and Treatment Center",1
6003,Office of Research & Development at China Medical University,1
8189,University of Colorado Boulder,1
6023,Ohio Depart?ment of Health,1
8176,"University of California, Irvine Genomics High Throughput Facility",1
8171,"University of California Berkeley, UCB",1
6021,Office on Women’s Health,1
6020,"Office of the Secretary of Transportation, OST",1
6018,Office of the Executive Dean for Research,1
8173,University of California San Diego Center of Excellence in Nanomedicine,1
8174,University of California San Francisco,1
6016,"Office of the Assistant Secretary for Health, OASH",1
6015,"Office of Women's Health, OWH",1
6014,Office of Science and Technology,1
8187,"University of Chittagong, UC, -P&D/7-37)",1
6013,Office of Research on Women’s Health,1
8183,University of California-Irvine,1
6010,"Office of Research and Development, and Rehabilitation Research and Development Service",1
8185,University of Chicago Women’s Board,1
6008,"Office of Research and Development, Clinical Sciences R&D",1
6007,Office of Research Services,1
8186,"University of Chinese Academy of Sciences, UCAS",1
6005,Office of Research Development,1
6062,"Ontario Genomics Institute, OGI",1
6063,"Ontario Mental Health Foundation, OMHF",1
8150,University Medical Centre Mainz,1
6115,Ormond Street Hospital NHS Foundation Trust,1
6123,Oslo Diabetes Research Centre,1
6122,Oskar Öflunds Stiftelse,1
6121,Oskar Öflund Foundation,1
8124,"University College Dublin, UCD",1
6119,Osaka Police Hospital,1
6118,Osaka General Medical Center,1
6117,Ortho Biotech Products LP,1
6116,"Országos Tudományos Kutatási Alapprogramok, OTKA",1
6114,Orionin Tutkimussäätiö,1
6124,"Osteoporosis Australia, OA",1
8125,University College London,1
6112,Organization for the Prevention of Blindness,1
8126,University College London Hospitals NHS Foundation Trust,1
6111,Organización Médica de Investigación,1
6110,Organisme pour la Prévention de la Cécité,1
6109,Organisation of Care,1
6108,"Oregon National Primate Research Center, ONPRC",1
6107,Oregon Lions Sight and Hearing Foundation,1
8123,University College Dublin,1
6125,Osteoporosis Australia/Australia and New Zealand Bone and Mineral Society,1
6105,"Optovue, Inc.",1
6133,Otto A. Malm Lahjoitusrahasto,1
6140,Outstanding Youth Medical Talents Program of Shanghai Health and Family Planning Commission,1
6139,Outstanding Youth Foundation of Jiangsu Province of China,1
6138,Outstanding Young Backbone Talents of Anhui University,1
6137,Outstanding Talents of the First Affiliated Hospital of Chongqing Medical University,1
8110,"Universitair Medisch Centrum Utrecht, UMC",1
6136,Outstanding Leaders Training Program of Pudong Health Bureau of Shanghai,1
6135,Outstanding Clinical Discipline Project of Shanghai Pudong,1
6134,Outstanding Academic Leader Project of Shanghai Health and Family Planning Committee,1
8111,"Universitaire Ziekenhuizen Leuven, KU Leuven, UZ Leuven",1
6126,"Oswaldo Cruz German Hospital, and Science Foundation Ireland",1
8116,"Universiti Malaya, UM",1
6131,"Otsuka Pharma Co., Ltd.",1
8117,Universiti Putra Malaysia,1
8118,Universiti Putra Research,1
8119,Universiti Sains Malaysia,1
8120,"Universiti Teknologi MARA, UiTM",1
6127,Oswaldo Cruz Institute,1
8121,Universities of the State of Baden-Württemberg,1
8128,University Diabetes Center,1
8129,University Eye Clinic Maastricht,1
8149,University Medical Centre Ljubljana Research and Development,1
6072,Open Fund of Fujian Provincial Key Laboratory of Plasma and Magnetic Resonance,1
8142,University Hospital of Umeå,1
8143,University Hospitals Birmingham NHS Foundation Trust,1
6079,"Operational Program Competitiveness, Entrepreneurship and Innovation",1
6078,Opening Project of Guangxi Colleges and Universities Key Laboratory of Robot Welding,1
6077,Opening Project of Guangdong Province Key Laboratory of Information Security Technology,1
8144,"University Hospitals Bristol NHS Foundation Trust, UHBW",1
8145,University Hospitals Eye Institute,1
6073,Open Project of Shanghai Key Laboratory of Sleep-Disordered Breathing,1
6071,Opaskwayak Cree Nation,1
6082,Ophthalmic Animal Laboratory of Zhongshan Ophthalmic Center,1
6070,Ontario Thoracic Society,1
6069,"Ontario Stroke Network, OSN",1
6068,Ontario Research Fund for Research Excellence,1
6067,"Ontario Ministry of Research, Innovation and Science, MRIS",1
8146,University Hospitals of Cleveland,1
6065,Ontario Ministry of Health and Long-Term Care,1
6064,Ontario Ministry of Health,1
8148,University Medical Center,1
6081,Ophtalmologie de l'Université de Montréal,1
6083,Ophthalmic Consultants of Long Island,1
8130,University Grant Commission,1
8133,University Grants Commission?University,1
8131,University Grants Commission,1
6101,Optometry Australia,1
6100,"Optimum Patient Care, OPC",1
6099,Optimize Future Therapy,1
6098,Optimedica Corp.,1
6097,"Optical Society, OSA",1
6096,Opthea Limited,1
6095,Opthea DMC,1
6094,Oppenheimer Family Foundation,1
6084,Ophthalmic Research Institute of Australia and Commercial Development,1
6093,Ophthotech Corportation,1
8134,University Grants Commission‒University,1
8135,"University Grants Committee, UGC",1
8136,"University Health Network, UHN",1
6090,"Ophthalmology and Neuroscience, Baltimore",1
6089,Ophthalmology Foundation Board,1
8139,University Hospital Gießen and Marburg Research Funds,1
8141,University Hospital of Reims,1
8205,"University of Florida Diabetes Research, Education, and Treatment Center",1
8207,"University of Georgia, UGA",1
8314,University of Toronto,1
8208,University of Ghana College of Health Science,1
8275,"University of Ottawa, UO",1
5891,Novartis Pharma B.V.,1
8277,University of P?cs,1
8278,University of Patras,1
5889,Novartis Nutrition,1
8280,University of Pennsylvania Clinical and Translational Science Award NIH,1
8281,University of Pennsylvania Core,1
8282,University of Pennsylvania Core Grant for Vision Research,1
5888,Novartis Medical Associates,1
8283,"University of Pennsylvania, Penn",1
5887,Novartis Ireland Ltd.,1
5886,Novartis Hellas,1
8285,"University of Pittsburgh, Pitt",1
5884,Novartis Healthcare Pvt. Ltd,1
5883,Novartis GMBH,1
5882,Novartis Fonds,1
5881,Novartis Canada Inc.,1
8286,"University of Queensland, UQ",1
8287,"University of Rhode Island, URI",1
5893,"Novartis Pharma K.K. , Alcon , Otsuka , Senju",1
5894,"Novartis Pharma K.K. , Alcon , Santen",1
5895,"Novartis Pharma K.K. , Bayer",1
8266,University of Northern Iowa,1
5914,Novartis/Alcon,1
5913,Novartis und Teva honoriert worden,1
5912,Novartis plc,1
5911,Novartis Schweiz AG,1
5910,Novartis Phrama K.K.,1
5909,Novartis Pharmaceuticals and Johnson & Johnson,1
8262,University of North Carolina Department of Ophthalmology,1
5906,Novartis Pharmaceuticals Corp.,1
8268,University of Nottingham,1
5896,"Novartis Pharma K.K. , Bayer , Alcon , Otsuka",1
5904,Novartis Pharmaceuticals Australia,1
5903,Novartis Pharmaceutical Corporation Bora Eldem,1
5902,Novartis Pharmaceutical,1
5899,Novartis Pharma K.K. Sanofi K.K.,1
8273,University of Otago,1
5898,"Novartis Pharma K.K. , Santen",1
8274,University of Ottawa Eye Institute,1
5897,"Novartis Pharma K.K. , Chengdu Kanghong Biotechnology",1
5878,"Novartis , Santen",1
5877,"Novartis , Alcon , and Santen",1
8288,University of Rochester Flaum Eye Institute,1
5851,North West Coast Clinical Research Network,1
5857,Northern Ireland Research and Development Office,1
8306,University of Tennessee Health Science Center Neuroscience Institute,1
5856,Northern Ireland Kidney Research Fund,1
8307,University of Tennessee Research Foundation,1
5854,"Northern California Institute for Research and Education, NCIRE",1
8308,"University of Texas Health Science Center at San Antonio, UTHSCSA",1
5853,"North-West University, NWU",1
5852,North Western Regional Health Authority,1
8309,"University of Texas Medical Branch, UTMB",1
5859,Northrup Grumman,1
5850,North Queensland Retina,1
5849,North Portugal Regional Operational Programme,1
8311,University of Texas System Neuroscience and Neurotechnology Research Institute,1
5847,North Denmark Region and Heinrich Kopps Foundation,1
5846,"North Carolina Translational and Clinical Sciences Institute, University of North Carolina at Chapel Hill, NC Tracs",1
8312,University of Tokushima,1
5844,"North Bristol NHS Trust, NBT",1
5843,North American Neuro-Ophthalmology Society,1
5858,Northrhine-West-phalian Ministry of Science,1
8304,University of Tasmania,1
8289,"University of San Diego, USD",1
5869,Norwegian Research Council for Science and Humanities,1
8290,"University of Saskatchewan, U of S",1
5874,NovaTarg Therapeutics,1
8291,"University of South Carolina, USC",1
8292,University of South China,1
8293,"University of South China, USC",1
8294,University of South Wales,1
5871,Norwich University Hospital,1
5870,Norwegian Society of Endocrinology,1
5868,Norwegian Diabetes Centre,1
5860,"Northwest Regional Development Agency, NWDA",1
8297,University of Surrey Doctoral College,1
5866,Norwegian Council on Cardiovascular Disease,1
5865,Norwegian Council on Cardio-vascular Diseases,1
8299,University of Sydney Australian Postgraduate Award,1
8300,University of Sydney Medical School Foundation,1
8301,"University of Sydney, USYD",1
5862,Norwegian Blind Mission IL,1
8303,University of Sydney-Wepon,1
8259,"University of Nebraska Medical Center, UNMC",1
8258,"University of Miyazaki Hospital, UMH",1
8256,University of Missouri-Kansas City School of Medicine,1
5960,ON Merrick Zwarenstein,1
5969,OSIG,1
8219,University of Illinois at Chicago Research to Prevent Blindness,1
5966,ONL Therapeutics to Massachusetts Eye and Ear,1
8222,University of Iowa Hospital and Clinics,1
8223,University of Iowa Hospitals and Clinic,1
5963,ONCE,1
5962,ON2,1
5961,ON Michael Hindmarsh,1
5959,ON Linda Stanley,1
5971,OTR,1
5958,ON Braden Te Hiwi,1
5957,OIRRC,1
8225,"University of Kentucky, UK",1
8226,"University of KwaZulu-Natal Developing Research Innovation, Localisation and Leadership in South Africa",1
5954,OFTARED,1
5953,OFD,1
5952,ODAS,1
5951,OD-OS GmbH,1
5970,OSU Eye Physicians & Surgeons,1
8218,University of Illinois at Chicago,1
8227,University of Kwazulu-Natal,1
5981,Obra Social Caja de Burgos,1
5987,Oculis SA,1
5986,Ocular Therapeutix Inc.,1
8209,University of Glasgow,1
8210,University of Helsinki,1
8211,University of Helsinki and Biocenter Finland,1
5984,Ocular Therapeutics,1
8212,University of Helsinki and Biocentre Finland,1
5982,Obsidian Research Limited,1
5980,"Object Background Separation in Images, Retinal Image Feature Detection Method Using Deep Neural Networks",1
5973,OVPRS,1
8213,University of Helsinki including Helsinki University Central Hospital,1
8214,"University of Hong Kong, HKU",1
5978,"Oakland University, OU",1
5977,Oakland University William Beaumont School of Medicine,1
5976,"Oak Ridge National Laboratory, ORNL",1
8215,"University of Hyderabad, UoH",1
5975,Oak Forest,1
8216,University of Illinois Core,1
5950,OAR/NIH,1
5949,Nyurguyana Grigoryeva,1
8255,"University of Mississippi, UM",1
5925,Novo Nordisk Ltd.,1
8239,"University of Mauritius, UoM",1
5929,Novo Nordisk ResearchF oundation,1
8240,University of Medical & Health Sciences,1
5928,Novo Nordisk Pharma Research Institute,1
8241,University of Medicine and Dentistry–New Jersey Medical School,1
8243,University of Melbourne Department of Medicine,1
8248,University of Miami’s Office of the Vice Provost for Research and Scholarship,1
5926,Novo Nordisk Novo Nordisk,1
5924,Novo Nordisk Foundation Challenge Programme,1
5931,Novo Nordisk Scandinavia AB,1
5923,Novo Nordisk Foundation Center for Basic Metabolic Research,1
5922,Novo Nordisk Foundation,1
5920,Novo Nordisk Fonden,1
8250,University of Michigan Kellogg Eye Center,1
8251,University of Michigan Translational Research and Commercialization for Life Sciences,1
8253,"University of Minnesota, UMN",1
5917,Novo Nordisk Farma BV,1
5916,Novo Nordisk Canada,1
5930,Novo Nordisk S.p.A.,1
5932,Novo Nordisk SpA,1
5948,Nylands Nation,1
5941,Nucleus of Excellence Support Program,1
8229,"University of Limerick, UL",1
8230,"University of London, UoL",1
5946,Nutrición Médica y Tecnología,1
5945,"Nurses Organization of Veterans Affairs, NOVA",1
5944,Nuovo Ospedale Santa Chiara,1
5943,Nukada Institute for Medical and Biological Research,1
8231,University of Louisville Summer Research Scholar Program,1
5942,Nuffield Foundation,1
5940,NovoNordiskFoundation,1
8238,"University of Massachusetts Medical School, UMMS",1
5939,NovoNordisk and Sanofi,1
8232,"University of Louisville, UL",1
5937,NovoNordisc,1
5935,"Novo Nordisk, Inc.",1
8234,"University of Manitoba, U of M",1
8235,"University of Manitoba, UM",1
5933,Novo Nordisk UK Research Foundation,1
8236,"University of Maryland School of Public Health, SPH",1
5644,National Sciences Foundation of China,1
7397,St. Marianna University School of Medicine,1
5642,National Science and Technology Innovative Drug Project of China,1
5224,NKFIH OTKA,1
5223,NJIT Undergraduate Research and Innovation,1
5222,NIWA1,1
5221,NIRRCH,1
8700,Yrjo Jahnsson Foundation,1
5219,NINDS/NIH,1
5218,NIMH/NIH,1
5217,NIHR21EY031813-01A1,1
5216,NIHR-HTA,1
8702,Yu Dou,1
8703,Yucca Enterprises,1
5214,NIHR partnership,1
5213,"NIHR School for Primary Care Research, NIHR SPCR",1
8704,Yuichi Matsushita and Masafumi Tenta,1
8705,"Yukawa Institute for Theoretical Physics, Kyoto University, YITP",1
8706,Yuki Fushiki and Masayuki Domichi,1
8707,Yunnan Applied Basic Research Projects Items,1
8708,Yunnan Health Training Project of High Level Talents,1
8709,Yunnan Health Training Project of High-Level Talents,1
5208,NIHR Maudsley BRC,1
8699,Youth Science Research Project of Shanxi Basic Research Program,1
8697,Youth Science Foundation of Henan Normal University,1
8689,Youth Foundation of Shanghai Municipal Health Bureau,1
5225,NMRC IRG07nov013 Singapore,1
5240,NRF/MEST,1
5239,NRF-2017R1C1B5077060,1
8692,Youth Innovation in Medical Research in Sichuan Province,1
5237,NRF-2016M3A9B6902872,1
5236,NRCTM,1
5235,NRCBS,1
5234,NPUST-KMU,1
8693,Youth Medical Talent Project of Jiangsu Province,1
8694,Youth Medical Talents,1
8695,Youth Programof National Natural Science Foundation of China,1
5233,NOVARTIS Foundation  for the Promotion of Science,1
5232,NOVA University of Lisbon,1
5231,NORTE,1
5230,NORDIC,1
5229,NOBORI,1
8696,Youth Project of Wuxi Health and Commission,1
5228,NNSFC,1
5227,NNSF,1
5226,NNE,1
5207,NIHR MRC,1
5206,"NIHR Leicester-Loughborough Diet, Lifestyle and Physical Activity Biomedical Research Unit",1
8710,Yunnan High-Level Health And Family Planning Technical Personnel Training Project,1
8711,Yunnan High-Level Health and Family Planning Technical Personnel Training Project,1
5183,NIHR ARC,1
8727,"Yunnan Provincial Science and Technology Department, )",1
5181,NIH/NINDS,1
5180,NIH/NIGMS,1
8728,"Yunnan Provincial Science and Technology Department, China",1
5178,NIH/NIAMS,1
5177,NIH/NIAAA,1
8729,Yunnan Science and Technology Department‐ Kunming Medical University,1
5175,NIH/NHLBI,1
8730,Yunnan Science and Technology Talent and Platform Program,1
8731,"Yunnan University, YNU",1
